{
  "$schema": "http://json-schema.org/draft-07/schema#",
  "$id": "https://alchemy.aventiqlab.com/schemas/quiz.schema.json",
  "title": "Alchemy Quiz Definition",
  "type": "object",
  "additionalProperties": false,
  "required": ["quizId", "title", "passingScorePercent", "questions"],
  "properties": {
    "quizId": { "type": "string", "pattern": "^[a-z0-9]+(?:-[a-z0-9]+)*$" },
    "title": { "type": "string", "maxLength": 160 },
    "passingScorePercent": { "type": "integer", "minimum": 1, "maximum": 100 },
    "shuffleQuestions": { "type": "boolean", "default": false },
    "questions": {
      "type": "array",
      "minItems": 1,
      "items": {
        "type": "object",
        "additionalProperties": false,
        "required": ["id", "type", "prompt", "options", "correctOptionIds"],
        "properties": {
          "id": { "type": "string", "pattern": "^q[0-9]+$" },
          "type": { "type": "string", "enum": ["single", "multiple", "true_false"] },
          "prompt": { "type": "string", "minLength": 5, "maxLength": 1000 },
          "options": {
            "type": "array",
            "minItems": 2,
            "items": {
              "type": "object",
              "additionalProperties": false,
              "required": ["id", "text"],
              "properties": {
                "id": { "type": "string", "pattern": "^[a-z]$" },
                "text": { "type": "string", "maxLength": 500 }
              }
            }
          },
          "correctOptionIds": { "type": "array", "minItems": 1, "uniqueItems": true, "items": { "type": "string", "pattern": "^[a-z]$" } },
          "explanation": { "type": "string", "maxLength": 1000 },
          "skillIds": { "type": "array", "items": { "type": "string", "pattern": "^[a-z0-9]+(?:-[a-z0-9]+)*$" }, "uniqueItems": true },
          "dimension": { "type": "string", "enum": ["KNOW", "UNDERSTAND", "BUILD", "OPERATE", "TROUBLESHOOT", "DESIGN", "EXPLAIN"] }
        }
      }
    }
  }
}
